{
  "$id": "https://api.cerbos.dev/authzen/authorization/v1/AccessEvaluationBatchRequest.schema.json",
  "$schema": "http://json-schema.org/draft-07/schema#",
  "definitions": {
    "authzen.authorization.v1.AccessEvaluationBatchRequest.Evaluation": {
      "type": "object",
      "additionalProperties": false,
      "properties": {
        "action": {
          "$ref": "#/definitions/authzen.authorization.v1.Action"
        },
        "context": {
          "type": "object",
          "additionalProperties": {
            "$ref": "#/definitions/google.protobuf.Value"
          },
          "propertyNames": {
            "type": "string",
            "minLength": 1
          }
        },
        "resource": {
          "$ref": "#/definitions/authzen.authorization.v1.Resource"
        },
        "subject": {
          "$ref": "#/definitions/authzen.authorization.v1.Subject"
        }
      }
    },
    "authzen.authorization.v1.Action": {
      "type": "object",
      "required": [
        "name"
      ],
      "additionalProperties": false,
      "properties": {
        "name": {
          "type": "string",
          "minLength": 1
        },
        "properties": {
          "type": "object",
          "additionalProperties": {
            "$ref": "#/definitions/google.protobuf.Value"
          },
          "propertyNames": {
            "type": "string",
            "minLength": 1
          }
        }
      }
    },
    "authzen.authorization.v1.Resource": {
      "type": "object",
      "required": [
        "type",
        "id"
      ],
      "additionalProperties": false,
      "properties": {
        "id": {
          "type": "string",
          "minLength": 1
        },
        "properties": {
          "type": "object",
          "additionalProperties": {
            "$ref": "#/definitions/google.protobuf.Value"
          },
          "propertyNames": {
            "type": "string",
            "minLength": 1
          }
        },
        "type": {
          "type": "string",
          "minLength": 1
        }
      }
    },
    "authzen.authorization.v1.Subject": {
      "type": "object",
      "required": [
        "type",
        "id"
      ],
      "additionalProperties": false,
      "properties": {
        "id": {
          "type": "string",
          "minLength": 1
        },
        "properties": {
          "type": "object",
          "additionalProperties": {
            "$ref": "#/definitions/google.protobuf.Value"
          },
          "propertyNames": {
            "type": "string",
            "minLength": 1
          }
        },
        "type": {
          "type": "string",
          "minLength": 1
        }
      }
    },
    "google.protobuf.Value": {
      "title": "Value",
      "description": "A dynamically-typed value."
    }
  },
  "type": "object",
  "additionalProperties": false,
  "properties": {
    "action": {
      "$ref": "#/definitions/authzen.authorization.v1.Action"
    },
    "context": {
      "type": "object",
      "additionalProperties": {
        "$ref": "#/definitions/google.protobuf.Value"
      },
      "propertyNames": {
        "type": "string",
        "minLength": 1
      }
    },
    "evaluations": {
      "type": "array",
      "items": {
        "$ref": "#/definitions/authzen.authorization.v1.AccessEvaluationBatchRequest.Evaluation"
      },
      "minItems": 1
    },
    "resource": {
      "$ref": "#/definitions/authzen.authorization.v1.Resource"
    },
    "subject": {
      "$ref": "#/definitions/authzen.authorization.v1.Subject"
    }
  }
}
