{
  "subject": {
    "type": "user",
    "id": "john",
    "properties": {
      "cerbos.scope": "acme.hr",
      "cerbos.roles": [
        "employee"
      ],
      "department": "marketing",
      "geography": "GB",
      "team": "design",
      "ip_address": "10.20.5.5"
    }
  },
  "resource": {
    "type": "leave_request",
    "id": "XX225",
    "properties": {
      "cerbos.scope": "acme.hr",
      "department": "marketing",
      "geography": "GB",
      "id": "XX225",
      "owner": "john",
      "team": "design"
    }
  },
  "action": {
    "name": "create",
    "properties": {}
  },
  "context": {
    "cerbos.requestId": "test",
    "cerbos.includeMeta": true
  }
}
